{
 "schema": "observstory.snapshot/v1",
 "generated_at": "2026-09-14T17:00:00Z",
 "trigger": {
  "event": "demo-lab"
 },
 "repository": {
  "full_name": "northstar/chat-app",
  "url": null,
  "default_branch": "main",
  "visibility": "public",
  "description": "Synthetic demo repository"
 },
 "window": {
  "hours": 48,
  "since": "2026-09-12T17:00:00Z"
 },
 "config": {
  "source": "file",
  "lanes_source": "config",
  "title": "Northstar chat (synthetic demo)",
  "signals": {
   "overlap_min_work_items": 2,
   "stale_hours": 72,
   "burst_min_commits": 8,
   "burst_window_minutes": 30,
   "overlap_require_shared_file": true
  },
  "ignore": [
   "package-lock.json",
   "yarn.lock",
   "pnpm-lock.yaml",
   "poetry.lock",
   "Cargo.lock",
   "go.sum",
   "uv.lock",
   "Gemfile.lock",
   "composer.lock",
   "dist/",
   "build/",
   "node_modules/",
   "vendor/",
   "*.min.js",
   "*.min.css",
   "*.map",
   "CHANGELOG*",
   ".changeset/",
   "*.api.md",
   "/observstory/"
  ],
  "containers": [
   "src",
   "packages",
   "apps",
   "services",
   "lib",
   "libs",
   "app",
   "modules",
   "crates",
   "internal",
   "cmd"
  ],
  "area_depth": 1
 },
 "summary": {
  "in_flight": 3,
  "areas_active": 5,
  "commits_in_window": 2,
  "open_issues": 0,
  "signals": {
   "overlap": 0,
   "stale": 0,
   "waiting": 0,
   "burst": 0
  }
 },
 "lanes": [
  {
   "id": "intent",
   "label": "Intent",
   "description": "Why and what: docs and decisions",
   "source": "config",
   "areas": [],
   "in_flight": [],
   "recent_commits": 0
  },
  {
   "id": "core",
   "label": "Core",
   "description": "Conversation and search engine",
   "source": "config",
   "areas": [
    "src/conversation",
    "src/search"
   ],
   "in_flight": [
    "pr:41",
    "pr:42"
   ],
   "recent_commits": 0
  },
  {
   "id": "interface",
   "label": "Interface",
   "description": "What people see",
   "source": "config",
   "areas": [
    "web"
   ],
   "in_flight": [
    "direct:sofia"
   ],
   "recent_commits": 1
  },
  {
   "id": "verify",
   "label": "Verify",
   "description": "Tests and evaluations",
   "source": "config",
   "areas": [
    "evals"
   ],
   "in_flight": [
    "pr:45"
   ],
   "recent_commits": 0
  },
  {
   "id": "ship",
   "label": "Ship",
   "description": "Build and deploy",
   "source": "config",
   "areas": [
    ".github"
   ],
   "in_flight": [
    "direct:ben"
   ],
   "recent_commits": 1
  }
 ],
 "areas": [
  {
   "id": ".github",
   "lane": "ship",
   "in_flight": [
    "direct:ben"
   ],
   "files": [
    ".github/workflows/ci.yml"
   ],
   "recent_commits": 1,
   "actors": [
    "ben"
   ],
   "last_activity_at": "2026-09-13T15:00:00Z"
  },
  {
   "id": "evals",
   "lane": "verify",
   "in_flight": [
    "pr:45"
   ],
   "files": [
    "evals/search/cases.json",
    "evals/search/run.py"
   ],
   "recent_commits": 0,
   "actors": [
    "sofia"
   ],
   "last_activity_at": "2026-09-14T15:00:00Z"
  },
  {
   "id": "src/conversation",
   "lane": "core",
   "in_flight": [
    "pr:41"
   ],
   "files": [
    "src/conversation/memory.py",
    "src/conversation/store.py"
   ],
   "recent_commits": 0,
   "actors": [
    "alice"
   ],
   "last_activity_at": "2026-09-14T15:00:00Z"
  },
  {
   "id": "src/search",
   "lane": "core",
   "in_flight": [
    "pr:42"
   ],
   "files": [
    "src/search/index.py",
    "src/search/query.py"
   ],
   "recent_commits": 0,
   "actors": [
    "ben"
   ],
   "last_activity_at": "2026-09-14T15:00:00Z"
  },
  {
   "id": "web",
   "lane": "interface",
   "in_flight": [
    "direct:sofia"
   ],
   "files": [
    "web/chat/Thread.tsx"
   ],
   "recent_commits": 1,
   "actors": [
    "sofia"
   ],
   "last_activity_at": "2026-09-13T18:00:00Z"
  }
 ],
 "work_items": [
  {
   "id": "pr:41",
   "kind": "pull_request",
   "number": 41,
   "title": "Conversation memory",
   "url": null,
   "state": "open",
   "in_flight": true,
   "head": "alice/conversation-memory",
   "base": "main",
   "actors": [
    "alice"
   ],
   "created_at": "2026-09-14T09:00:00Z",
   "last_activity_at": "2026-09-14T15:00:00Z",
   "paths": [
    "src/conversation/memory.py",
    "src/conversation/store.py"
   ],
   "areas": [
    "src/conversation"
   ],
   "lanes": [
    "core"
   ],
   "commit_count": 3,
   "review_state": "no_reviewer",
   "waiting_on": [],
   "agent_declared": false,
   "burst": null,
   "merge_base": {
    "sha": "e9d03a99fea174c3dd53baed43383ee35683b49f",
    "source": "compare"
   }
  },
  {
   "id": "pr:42",
   "kind": "pull_request",
   "number": 42,
   "title": "Search index",
   "url": null,
   "state": "open",
   "in_flight": true,
   "head": "ben/search-index",
   "base": "main",
   "actors": [
    "ben"
   ],
   "created_at": "2026-09-14T10:00:00Z",
   "last_activity_at": "2026-09-14T15:00:00Z",
   "paths": [
    "src/search/index.py",
    "src/search/query.py"
   ],
   "areas": [
    "src/search"
   ],
   "lanes": [
    "core"
   ],
   "commit_count": 2,
   "review_state": "no_reviewer",
   "waiting_on": [],
   "agent_declared": false,
   "burst": null,
   "merge_base": {
    "sha": "e9d03a99fea174c3dd53baed43383ee35683b49f",
    "source": "compare"
   }
  },
  {
   "id": "pr:45",
   "kind": "pull_request",
   "number": 45,
   "title": "Search relevance evals",
   "url": null,
   "state": "open",
   "in_flight": true,
   "head": "sofia/pr-45",
   "base": "main",
   "actors": [
    "sofia"
   ],
   "created_at": "2026-09-14T11:00:00Z",
   "last_activity_at": "2026-09-14T15:00:00Z",
   "paths": [
    "evals/search/cases.json",
    "evals/search/run.py"
   ],
   "areas": [
    "evals"
   ],
   "lanes": [
    "verify"
   ],
   "commit_count": 2,
   "review_state": "no_reviewer",
   "waiting_on": [],
   "agent_declared": false,
   "burst": null,
   "merge_base": {
    "sha": "e9d03a99fea174c3dd53baed43383ee35683b49f",
    "source": "compare"
   }
  },
  {
   "id": "direct:sofia",
   "kind": "direct",
   "number": null,
   "title": "Direct pushes to main",
   "url": null,
   "state": "pushed",
   "in_flight": false,
   "head": "main",
   "base": null,
   "actors": [
    "sofia"
   ],
   "created_at": null,
   "last_activity_at": "2026-09-13T18:00:00Z",
   "paths": [
    "web/chat/Thread.tsx"
   ],
   "areas": [
    "web"
   ],
   "lanes": [
    "interface"
   ],
   "commit_count": 1,
   "review_state": null,
   "waiting_on": [],
   "agent_declared": false,
   "burst": null,
   "merge_base": null
  },
  {
   "id": "direct:ben",
   "kind": "direct",
   "number": null,
   "title": "Direct pushes to main",
   "url": null,
   "state": "pushed",
   "in_flight": false,
   "head": "main",
   "base": null,
   "actors": [
    "ben"
   ],
   "created_at": null,
   "last_activity_at": "2026-09-13T15:00:00Z",
   "paths": [
    ".github/workflows/ci.yml"
   ],
   "areas": [
    ".github"
   ],
   "lanes": [
    "ship"
   ],
   "commit_count": 1,
   "review_state": null,
   "waiting_on": [],
   "agent_declared": false,
   "burst": null,
   "merge_base": null
  }
 ],
 "commits": [
  {
   "sha": "e9d03a99fea174c3dd53baed43383ee35683b49f",
   "url": null,
   "message": "Tighten thread spacing",
   "date": "2026-09-13T18:00:00Z",
   "actor": "sofia",
   "paths": [
    "web/chat/Thread.tsx"
   ],
   "areas": [
    "web"
   ],
   "work_item": "direct:sofia"
  },
  {
   "sha": "5100097869de46da279d4c9bebebee7bfa195f75",
   "url": null,
   "message": "Cache dependencies in CI",
   "date": "2026-09-13T15:00:00Z",
   "actor": "ben",
   "paths": [
    ".github/workflows/ci.yml"
   ],
   "areas": [
    ".github"
   ],
   "work_item": "direct:ben"
  }
 ],
 "issues": [],
 "actors": [
  {
   "id": "alice",
   "kind": "human",
   "linked": true,
   "work_items": [
    "pr:41"
   ]
  },
  {
   "id": "ben",
   "kind": "human",
   "linked": true,
   "work_items": [
    "direct:ben",
    "pr:42"
   ]
  },
  {
   "id": "sofia",
   "kind": "human",
   "linked": true,
   "work_items": [
    "direct:sofia",
    "pr:45"
   ]
  }
 ],
 "signals": [],
 "provenance": {
  "source": "synthetic (Demo Lab)",
  "collector": "blackmath88/observstory",
  "collector_version": "1.0.0",
  "observations_fetched_at": "2026-09-14T17:00:00Z",
  "api_calls": 0,
  "rate_limit_remaining": null,
  "degraded": []
 }
}